{
  "schema_version": "benchmark-trace/v1",
  "contract": {
    "name": "benchmark-trace",
    "version": "1.1.0",
    "schema_digest": "12121cb7fbdb81b1637954eefab17b1faaf39ecdff1ed4fe0d67065941ca4b17"
  },
  "run_id": "run-example-001",
  "benchmark": "swe-bench-verified",
  "framework": "example-agent",
  "created_at": "2026-01-02T03:04:05Z",
  "finalized_at": "2026-01-02T03:04:07Z",
  "selection": {
    "strategy": "explicit_ids",
    "requested_count": 1,
    "instance_ids": [
      "example/project__issue-1"
    ]
  },
  "attempts": [
    {
      "trace_id": "trace-example-001",
      "instance_id": "example/project__issue-1",
      "attempt": 1,
      "path": "instances/example%2Fproject__issue-1/attempt-1",
      "status": "completed"
    }
  ]
}
