{"attempts":[{"attempt":1,"instance_id":"fix-git","path":"instances/fix-git/attempt-1","status":"completed","trace_id":"trace-edc953d051894e219e1da8aba9c8c00e"},{"attempt":1,"instance_id":"openssl-selfsigned-cert","path":"instances/openssl-selfsigned-cert/attempt-1","status":"completed","trace_id":"trace-095053ce42bc4d19a564864597ea3624"},{"attempt":1,"instance_id":"regex-log","path":"instances/regex-log/attempt-1","status":"degraded","trace_id":"trace-5c179851f34949e6834176638b5feacd"},{"attempt":1,"instance_id":"extract-elf","path":"instances/extract-elf/attempt-1","status":"completed","trace_id":"trace-1b7863db9ade43c48fbaf5888dc6836c"},{"attempt":1,"instance_id":"vulnerable-secret","path":"instances/vulnerable-secret/attempt-1","status":"completed","trace_id":"trace-2995a4d8fd314221878bad9f71780ebb"}],"benchmark":"terminal-bench-2.1","contract":{"name":"benchmark-trace","schema_digest":"c54f3134f6d71167a7af3647f729a706dc5677edac914b89860a2a50c1d32d9a","version":"1.2.0"},"created_at":"2026-08-10T22:45:20.708Z","finalized_at":"2026-08-10T23:14:40.864Z","framework":"openhands","run_id":"trace-run-d412e5a4e14148f5859d13644fe5e73c","schema_version":"benchmark-trace/v1","selection":{"instance_ids":["fix-git","openssl-selfsigned-cert","regex-log","extract-elf","vulnerable-secret"],"requested_count":5,"strategy":"explicit_ids"}}
