{"attempts":[{"attempt":1,"instance_id":"fix-git","path":"instances/fix-git/attempt-1","status":"completed","trace_id":"trace-32879be81ead40af8ff2aa4b1018dce0"},{"attempt":1,"instance_id":"openssl-selfsigned-cert","path":"instances/openssl-selfsigned-cert/attempt-1","status":"completed","trace_id":"trace-6b51c01110184c539a3f57f0f2318c3e"},{"attempt":1,"instance_id":"regex-log","path":"instances/regex-log/attempt-1","status":"degraded","trace_id":"trace-2be4c197c5c74f5fb7473bfee044dcb1"},{"attempt":1,"instance_id":"extract-elf","path":"instances/extract-elf/attempt-1","status":"completed","trace_id":"trace-ca1411a91ea0470f83d08296e0ce97a8"},{"attempt":1,"instance_id":"vulnerable-secret","path":"instances/vulnerable-secret/attempt-1","status":"completed","trace_id":"trace-124fdfc379344037b665ff909dce25af"}],"benchmark":"terminal-bench-2.1","contract":{"name":"benchmark-trace","schema_digest":"c54f3134f6d71167a7af3647f729a706dc5677edac914b89860a2a50c1d32d9a","version":"1.2.0"},"created_at":"2026-07-28T00:33:36.987Z","finalized_at":"2026-07-28T01:27:48.344Z","framework":"openhands","run_id":"trace-run-0fab82d37d02492cb4cc6bc76b909c5a","schema_version":"benchmark-trace/v1","selection":{"instance_ids":["fix-git","openssl-selfsigned-cert","regex-log","extract-elf","vulnerable-secret"],"requested_count":5,"strategy":"explicit_ids"}}
