{"attempts":[{"attempt":1,"instance_id":"astropy__astropy-12907","path":"instances/astropy__astropy-12907/attempt-1","status":"failed","trace_id":"trace-f17f6eca860b4f50bceb96ad8e77418e"}],"benchmark":"swe-bench-lite","contract":{"name":"benchmark-trace","schema_digest":"c54f3134f6d71167a7af3647f729a706dc5677edac914b89860a2a50c1d32d9a","version":"1.2.0"},"created_at":"2026-08-10T02:20:29.997Z","finalized_at":"2026-08-10T02:34:49.795Z","framework":"openhands","run_id":"trace-run-06fa82ba77c24bb2a99b7db38c128681","schema_version":"benchmark-trace/v1","selection":{"instance_ids":["astropy__astropy-12907"],"requested_count":1,"strategy":"explicit_ids"}}
