{"attempts":[{"attempt":1,"instance_id":"fix-git","path":"instances/fix-git/attempt-1","status":"completed","trace_id":"trace-dee401f202ae459a9d60e75d7bf2d82c"}],"benchmark":"terminal-bench-2.1","contract":{"name":"benchmark-trace","schema_digest":"c54f3134f6d71167a7af3647f729a706dc5677edac914b89860a2a50c1d32d9a","version":"1.2.0"},"created_at":"2026-08-10T04:42:08.615Z","finalized_at":"2026-08-10T04:49:29.663Z","framework":"openhands","run_id":"trace-run-27d19cfb064b4ec88151a3919768b355","schema_version":"benchmark-trace/v1","selection":{"instance_ids":["fix-git"],"requested_count":1,"strategy":"explicit_ids"}}
