{"attempts":[{"attempt":1,"instance_id":"matplotlib__matplotlib-20676","path":"instances/matplotlib__matplotlib-20676/attempt-1","status":"failed","trace_id":"trace-30810cc6c4fd4a1ab467660d2c2fd48e"},{"attempt":1,"instance_id":"pytest-dev__pytest-7432","path":"instances/pytest-dev__pytest-7432/attempt-1","status":"failed","trace_id":"trace-a7a1cbd9db81490f828c087c80181d8a"},{"attempt":1,"instance_id":"sympy__sympy-12096","path":"instances/sympy__sympy-12096/attempt-1","status":"failed","trace_id":"trace-df0b528bf5ee4467a28120d579532919"}],"benchmark":"swe-bench-verified","contract":{"name":"benchmark-trace","schema_digest":"c54f3134f6d71167a7af3647f729a706dc5677edac914b89860a2a50c1d32d9a","version":"1.2.0"},"created_at":"2026-08-10T22:10:46.967Z","finalized_at":"2026-08-10T23:22:28.173Z","framework":"openhands","run_id":"trace-run-ccfd10dc268f4cfebea28e21952bebc5","schema_version":"benchmark-trace/v1","selection":{"instance_ids":["matplotlib__matplotlib-20676","pytest-dev__pytest-7432","sympy__sympy-12096"],"requested_count":3,"strategy":"explicit_ids"}}
