{"attempts":[{"attempt":1,"instance_id":"astropy__astropy-14309","path":"instances/astropy__astropy-14309/attempt-1","status":"failed","trace_id":"trace-1dc4ed5dc4674569a2db23e282968a68"},{"attempt":1,"instance_id":"django__django-11099","path":"instances/django__django-11099/attempt-1","status":"failed","trace_id":"trace-c1458132316d4c0ebbfec9c60058c5ae"},{"attempt":1,"instance_id":"matplotlib__matplotlib-20676","path":"instances/matplotlib__matplotlib-20676/attempt-1","status":"failed","trace_id":"trace-f76d27b218e6420d81aff109c905a91f"},{"attempt":1,"instance_id":"pytest-dev__pytest-7432","path":"instances/pytest-dev__pytest-7432/attempt-1","status":"timeout","trace_id":"trace-08c796d04d2c4c7f955701e7bf842ef5"},{"attempt":1,"instance_id":"sympy__sympy-12096","path":"instances/sympy__sympy-12096/attempt-1","status":"failed","trace_id":"trace-938d6326a7d64738bb07bcddc8c00bb1"}],"benchmark":"swe-bench-verified","contract":{"name":"benchmark-trace","schema_digest":"c54f3134f6d71167a7af3647f729a706dc5677edac914b89860a2a50c1d32d9a","version":"1.2.0"},"created_at":"2026-07-28T04:33:09.950Z","finalized_at":"2026-07-28T06:03:08.746Z","framework":"openhands","run_id":"trace-run-e41f8802ff90409f91bf912f995c8525","schema_version":"benchmark-trace/v1","selection":{"instance_ids":["astropy__astropy-14309","django__django-11099","matplotlib__matplotlib-20676","pytest-dev__pytest-7432","sympy__sympy-12096"],"requested_count":5,"strategy":"explicit_ids"}}
