{"attempts":[{"attempt":1,"instance_id":"scikit-learn__scikit-learn-13439","path":"instances/scikit-learn__scikit-learn-13439/attempt-1","status":"failed","trace_id":"trace-eb255ef07143407f9d0c976353fda75b"}],"benchmark":"swe-bench-verified","contract":{"name":"benchmark-trace","schema_digest":"c54f3134f6d71167a7af3647f729a706dc5677edac914b89860a2a50c1d32d9a","version":"1.2.0"},"created_at":"2026-08-10T02:36:15.023Z","finalized_at":"2026-08-10T02:48:31.570Z","framework":"openhands","run_id":"trace-run-b6954c17603b4cbf9686794f744c317d","schema_version":"benchmark-trace/v1","selection":{"instance_ids":["scikit-learn__scikit-learn-13439"],"requested_count":1,"strategy":"explicit_ids"}}
